{
  "draft": "draft.json",
  "draft_sha256": "e99544c162b692545fda65eec6db856b4f0f0cfe71a26cc074b8955078ea7732",
  "master_sha256": "a07269ab779db206b6a84e738fc29e241dd96684c1e56200f9b99ad995323a16",
  "summary": {
    "pass": 15,
    "fail": 0,
    "needs_human": 0
  },
  "draft_errors": [],
  "lines": [
    {
      "line_id": "H-1",
      "status": "pass",
      "reasons": []
    },
    {
      "line_id": "S-1",
      "status": "pass",
      "reasons": []
    },
    {
      "line_id": "MAH-sub",
      "status": "pass",
      "reasons": []
    },
    {
      "line_id": "MAH-1",
      "status": "pass",
      "reasons": []
    },
    {
      "line_id": "MAH-2",
      "status": "pass",
      "reasons": []
    },
    {
      "line_id": "MAH-3",
      "status": "pass",
      "reasons": []
    },
    {
      "line_id": "CAN-sub",
      "status": "pass",
      "reasons": []
    },
    {
      "line_id": "CAN-1",
      "status": "pass",
      "reasons": []
    },
    {
      "line_id": "CAN-2",
      "status": "pass",
      "reasons": []
    },
    {
      "line_id": "CAN-3",
      "status": "pass",
      "reasons": []
    },
    {
      "line_id": "CAN-4",
      "status": "pass",
      "reasons": []
    },
    {
      "line_id": "E-1",
      "status": "pass",
      "reasons": []
    },
    {
      "line_id": "E-2",
      "status": "pass",
      "reasons": []
    },
    {
      "line_id": "E-3",
      "status": "pass",
      "reasons": []
    },
    {
      "line_id": "E-4",
      "status": "pass",
      "reasons": []
    }
  ]
}
